{
  "$schema": "https://json-schema.org/draft/2020-12/schema",
  "$id": "https://zipzap.local/schemas/phase-plan.schema.json",
  "title": "ZipZap Lightweight Phase Plan",
  "type": "object",
  "additionalProperties": false,
  "required": [
    "schema_version",
    "plan_id",
    "revision",
    "status",
    "title",
    "window",
    "items"
  ],
  "properties": {
    "schema_version": { "const": 1 },
    "plan_id": {
      "type": "string",
      "pattern": "^[a-z0-9]+(?:-[a-z0-9]+)*$"
    },
    "revision": { "type": "integer", "minimum": 1 },
    "status": { "enum": ["draft", "active", "completed", "cancelled"] },
    "title": { "type": "string", "minLength": 1 },
    "window": {
      "type": "object",
      "additionalProperties": false,
      "required": ["start", "end"],
      "properties": {
        "start": { "type": "string", "format": "date-time" },
        "end": { "type": "string", "format": "date-time" }
      }
    },
    "items": {
      "type": "array",
      "minItems": 1,
      "items": {
        "type": "object",
        "additionalProperties": false,
        "required": ["kind", "ref"],
        "properties": {
          "kind": { "enum": ["demand", "task"] },
          "ref": {
            "type": "string",
            "pattern": "^[a-z0-9]+(?:-[a-z0-9]+)*$"
          },
          "committed": { "type": "boolean", "default": false },
          "target_finish": {
            "type": ["string", "null"],
            "format": "date-time"
          }
        }
      }
    },
    "created_at": { "type": "string", "format": "date-time" },
    "updated_at": { "type": "string", "format": "date-time" }
  }
}
