{
  "schema_version": 1,
  "plan_id": "example-phase",
  "revision": 1,
  "status": "active",
  "title": "Cache reliability phase",
  "window": {
    "start": "2030-01-01T00:00:00.000Z",
    "end": "2030-01-31T23:59:59.000Z"
  },
  "items": [
    {
      "kind": "demand",
      "ref": "example-demand",
      "committed": true,
      "target_finish": "2030-01-10T00:00:00.000Z"
    }
  ]
}
